{
  "$schema": "https://json-schema.org/draft/2020-12/schema",
  "$id": "https://smithystache.dev/schemas/example-test-case/v1",
  "title": "Smithystache reference HTTP test case",
  "type": "object",
  "required": ["schema", "name", "steps"],
  "additionalProperties": false,
  "properties": {
    "schema": {
      "const": "smithystache.example.test-case/v1"
    },
    "name": {
      "type": "string",
      "minLength": 1
    },
    "description": {
      "type": "string"
    },
    "variables": {
      "type": "object",
      "additionalProperties": {
        "type": "string"
      }
    },
    "steps": {
      "type": "array",
      "minItems": 1,
      "items": {
        "$ref": "#/$defs/step"
      }
    }
  },
  "$defs": {
    "step": {
      "type": "object",
      "required": ["request", "expect"],
      "additionalProperties": false,
      "properties": {
        "id": {
          "type": "string"
        },
        "request": {
          "$ref": "#/$defs/request"
        },
        "expect": {
          "$ref": "#/$defs/expect"
        },
        "capture": {
          "type": "object",
          "additionalProperties": {
            "type": "string"
          }
        }
      }
    },
    "request": {
      "type": "object",
      "required": ["method", "path"],
      "additionalProperties": false,
      "properties": {
        "method": {
          "type": "string",
          "enum": ["GET", "POST", "PUT", "PATCH", "DELETE", "HEAD", "OPTIONS"]
        },
        "path": {
          "type": "string",
          "minLength": 1
        },
        "headers": {
          "type": "object",
          "additionalProperties": {
            "type": "string"
          }
        },
        "json": true,
        "body": {
          "type": "string"
        }
      }
    },
    "expect": {
      "type": "object",
      "required": ["status"],
      "additionalProperties": false,
      "properties": {
        "status": {
          "type": "integer"
        },
        "headers": {
          "type": "object",
          "additionalProperties": {
            "type": "string"
          }
        },
        "json": true,
        "body": {
          "type": "string"
        }
      }
    }
  }
}
